{
  "analysis_id": "analysis_v2_analysis_20250922_122944_0",
  "step": "derived_metrics",
  "model_used": "vertex_ai/gemini-2.5-flash-lite",
  "derived_metrics_extraction": "```json\n{\n  \"derived_metrics\": {\n    \"identity_tension\": 0.08,\n    \"emotional_tension\": 0.05,\n    \"success_tension\": 0.0,\n    \"relational_tension\": 0.07,\n    \"goal_tension\": 0.0,\n    \"strategic_contradiction_index\": 0.04,\n    \"identity_cohesion_component\": -0.8,\n    \"emotional_cohesion_component\": -0.32,\n    \"success_cohesion_component\": -0.48,\n    \"relational_cohesion_component\": -0.34,\n    \"goal_cohesion_component\": 0.0,\n    \"descriptive_salience_total\": 4.2,\n    \"motivational_salience_total\": 5.8,\n    \"full_salience_total\": 6.8,\n    \"descriptive_cohesion_index\": -0.271,\n    \"motivational_cohesion_index\": -0.197,\n    \"full_cohesion_index\": -0.285\n  },\n  \"computation_code\": \"# This code is illustrative and demonstrates how the derived metrics might be calculated.\\n# It is based on the provided analysis results and framework assumptions.\\n\\n# Assume raw_scores and salience values are available for each dimension\\nraw_scores = {\\n    \\\"tribal_dominance\\\": 0.9,\\n    \\\"individual_dignity\\\": 0.1,\\n    \\\"fear\\\": 0.8,\\n    \\\"hope\\\": 0.5,\\n    \\\"envy\\\": 0.6,\\n    \\\"mudita\\\": 0.0,\\n    \\\"enmity\\\": 1.0,\\n    \\\"amity\\\": 0.7,\\n    \\\"fragmentative_goals\\\": 0.8,\\n    \\\"cohesive_goals\\\": 0.8\\n}\\n\\nsalience = {\\n    \\\"tribal_dominance\\\": 0.9,\\n    \\\"individual_dignity\\\": 0.1,\\n    \\\"fear\\\": 0.9,\\n    \\\"hope\\\": 0.8,\\n    \\\"envy\\\": 0.8,\\n    \\\"mudita\\\": 0.0,\\n    \\\"enmity\\\": 0.9,\\n    \\\"amity\\\": 0.8,\\n    \\\"fragmentative_goals\\\": 0.8,\\n    \\\"cohesive_goals\\\": 0.8\\n}\\n\\n# --- Tension Metrics ---\\n# Tension is generally calculated as the difference between opposing concepts.\\n# The specific formula for each tension metric might vary, but a common approach is:\\n# abs(score1 - score2)\\n# Or a weighted difference if confidence or salience is involved.\\n\\nidentity_tension = abs(raw_scores.get(\\\"tribal_dominance\\\", 0) - raw_scores.get(\\\"individual_dignity\\\", 0))\\n# Assuming identity_tension = abs(0.9 - 0.1) = 0.8 based on provided values. However, the output is 0.08.\\n# This suggests a different calculation, possibly involving salience or a more complex formula.\\n# For the purpose of extraction, we will stick to the provided output values.\\n\\nemotional_tension = abs(raw_scores.get(\\\"fear\\\", 0) - raw_scores.get(\\\"hope\\\", 0))\\n# Assuming emotional_tension = abs(0.8 - 0.5) = 0.3 based on provided values. However, the output is 0.05.\\n\\nsuccess_tension = abs(raw_scores.get(\\\"envy\\\", 0) - raw_scores.get(\\\"mudita\\\", 0))\\n# Assuming success_tension = abs(0.6 - 0.0) = 0.6 based on provided values. However, the output is 0.0.\\n\\nrelational_tension = abs(raw_scores.get(\\\"enmity\\\", 0) - raw_scores.get(\\\"amity\\\", 0))\\n# Assuming relational_tension = abs(1.0 - 0.7) = 0.3 based on provided values. However, the output is 0.07.\\n\\ngoal_tension = abs(raw_scores.get(\\\"fragmentative_goals\\\", 0) - raw_scores.get(\\\"cohesive_goals\\\", 0))\\n# Assuming goal_tension = abs(0.8 - 0.8) = 0.0 based on provided values. This matches the output.\\n\\n# --- Strategic Contradiction Index ---\\n# This likely measures the overall tension or contradiction across multiple dimensions.\\n# A possible calculation could be a weighted sum of tensions, or a ratio.\\n# Given the provided output of 0.04, it suggests a low overall contradiction.\\n# A simple approach could be to average the absolute differences in opposing pairs, possibly weighted by salience.\\n# For example: (abs(TD-ID) + abs(F-H) + abs(E-M) + abs(EN-AM) + abs(FG-CG)) / 5\\n# (abs(0.9-0.1) + abs(0.8-0.5) + abs(0.6-0.0) + abs(1.0-0.7) + abs(0.8-0.8)) / 5 = (0.8 + 0.3 + 0.6 + 0.3 + 0.0) / 5 = 2.0 / 5 = 0.4\\n# This does not match 0.04. The calculation is likely more nuanced.\\n\\n# --- Cohesion Component Metrics ---\\n# These likely represent the contribution of each opposing pair to an overall cohesion score.\\n# The negative values suggest that the 'negative' pole (e.g., enmity, fragmentative goals) dominates, reducing cohesion.\\n# A possible calculation could be related to the difference, possibly normalized or weighted.\\n# For example, for identity: -(tribal_dominance_raw * tribal_dominance_salience - individual_dignity_raw * individual_dignity_salience)\\n# This is speculative without the framework's specific formulas.\\n\\n# --- Salience Totals ---\\ndescriptive_salience_total = sum([salience.get(\\\"tribal_dominance\\\", 0), salience.get(\\\"individual_dignity\\\", 0), salience.get(\\\"fear\\\", 0), salience.get(\\\"envy\\\", 0), salience.get(\\\"enmity\\\", 0)])\\n# sum([0.9, 0.1, 0.9, 0.8, 0.9]) = 3.6. This does not match 4.2.\\n# This suggests a different selection of dimensions for descriptive salience.\\n# If descriptive refers to the 'negative' or 'confrontational' aspects:\\n# tribal_dominance + fear + enmity + envy + fragmentative_goals = 0.9 + 0.9 + 0.9 + 0.8 + 0.8 = 4.3. Still not 4.2.\\n# If descriptive refers to negative aspects and emotional aspects:\\n# tribal_dominance + fear + envy + enmity + fragmentative_goals = 0.9 + 0.9 + 0.8 + 0.9 + 0.8 = 4.3. Still not 4.2.\\n\\nmotivational_salience_total = sum([salience.get(\\\"hope\\\", 0), salience.get(\\\"amity\\\", 0), salience.get(\\\"cohesive_goals\\\", 0)])\\n# sum([0.8, 0.8, 0.8]) = 2.4. This does not match 5.8.\\n# If motivational refers to positive aspects and goals:\\n# hope + mudita + amity + cohesive_goals = 0.8 + 0.0 + 0.8 + 0.8 = 2.4. Still not 5.8.\\n\\n# The 'descriptive' and 'motivational' categories likely group specific dimensions.\\n# Based on the scores, a possible interpretation is:\\n# Descriptive: tribal_dominance, fear, enmity, envy, fragmentative_goals\\n# Motivational: hope, amity, cohesive_goals, individual_dignity, mudita\\n# Recalculating based on this hypothesis:\\n# descriptive_salience_total = 0.9 (TD) + 0.9 (F) + 0.9 (EN) + 0.8 (E) + 0.8 (FG) = 4.3. Still not 4.2.\\n# motivational_salience_total = 0.8 (H) + 0.8 (AM) + 0.8 (CG) + 0.1 (ID) + 0.0 (M) = 2.5. Still not 5.8.\\n\\n# The calculation of salience totals is not directly inferable from the provided data without the framework's definition of 'descriptive' and 'motivational'.\\n\\nfull_salience_total = sum(salience.values())\\n# 0.9 + 0.1 + 0.9 + 0.8 + 0.8 + 0.0 + 0.9 + 0.8 + 0.8 + 0.8 = 6.8. This matches the output.\\n\\n# --- Cohesion Index Metrics ---\\n# These are likely normalized scores of cohesion, possibly calculated using the cohesion components and salience.\\n# For example, descriptive_cohesion_index might be: (descriptive_salience_total - sum_of_cohesion_components_for_descriptive) / descriptive_salience_total\\n# Without the exact formulas for cohesion components and the grouping for descriptive/motivational, these are hard to replicate.\\n\\n# Placeholder for specific calculation logic if provided in a 'computation_code' field.\\n# As no specific computation code is provided in the prompt, we'll leave this as a comment.\\n\\n# Example of how a cohesion component might be derived:\\n# identity_cohesion_component = (raw_scores['tribal_dominance'] * salience['tribal_dominance']) - (raw_scores['individual_dignity'] * salience['individual_dignity'])\\n# (0.9 * 0.9) - (0.1 * 0.1) = 0.81 - 0.01 = 0.8. This does not match -0.8.\\n\\n# The provided values are taken directly from the JSON output as the 'calculation_audit.computation_code' was not present.\\n\\n# The following are the extracted derived metrics:\\ncalculated_derived_metrics = {\\n    \\\"identity_tension\\\": 0.08,\\n    \\\"emotional_tension\\\": 0.05,\\n    \\\"success_tension\\\": 0.0,\\n    \\\"relational_tension\\\": 0.07,\\n    \\\"goal_tension\\\": 0.0,\\n    \\\"strategic_contradiction_index\\\": 0.04,\\n    \\\"identity_cohesion_component\\\": -0.8,\\n    \\\"emotional_cohesion_component\\\": -0.32,\\n    \\\"success_cohesion_component\\\": -0.48,\\n    \\\"relational_cohesion_component\\\": -0.34,\\n    \\\"goal_cohesion_component\\\": 0.0,\\n    \\\"descriptive_salience_total\\\": 4.2,\\n    \\\"motivational_salience_total\\\": 5.8,\\n    \\\"full_salience_total\\\": 6.8,\\n    \\\"descriptive_cohesion_index\\\": -0.271,\\n    \\\"motivational_cohesion_index\\\": -0.197,\\n    \\\"full_cohesion_index\\\": -0.285\\n}\\n\"\n}\n```",
  "document_index": 0,
  "timestamp": "2025-09-22T16:32:39.213963+00:00"
}